{"$schema":"https://json-schema.org/draft/2020-12/schema","$id":"https://chatgpt-lib.local/commands/set_semantic_fingerprint.schema.json","type":"object","additionalProperties":false,"required":["schema_version","operation_id","operation","work_ref","traits"],"properties":{"schema_version":{"const":1},"operation_id":{"type":"string","minLength":36,"maxLength":36},"operation":{"const":"set_semantic_fingerprint"},"work_ref":{"$ref":"https://chatgpt-lib.local/commands/common.schema.json#/$defs/workRef"},"traits":{"type":"array","uniqueItems":true,"items":{"type":"object","additionalProperties":false,"required":["term","source","confidence"],"properties":{"term":{"type":"string","minLength":3},"source":{"enum":["external_source","llm_inferred","user_explicit"]},"confidence":{"$ref":"https://chatgpt-lib.local/commands/common.schema.json#/$defs/confidence"}}}}}}
