{
  "schema_version": 1,
  "operation_id": "d4e8a1c6-39f7-4b25-8c10-6a2e5f9d3b71",
  "operation": "set_semantic_fingerprint",
  "work_ref": {
    "id": "source-code-2011"
  },
  "traits": [
    {
      "term": "genre.thriller",
      "source": "external_source",
      "confidence": "high"
    },
    {
      "term": "genre.science_fiction",
      "source": "external_source",
      "confidence": "high"
    },
    {
      "term": "genre.mystery",
      "source": "external_source",
      "confidence": "high"
    },
    {
      "term": "narrative.time_loop",
      "source": "llm_inferred",
      "confidence": "high"
    },
    {
      "term": "structure.mystery",
      "source": "llm_inferred",
      "confidence": "high"
    },
    {
      "term": "story.problem_solving",
      "source": "llm_inferred",
      "confidence": "high"
    },
    {
      "term": "story.intrigue",
      "source": "llm_inferred",
      "confidence": "high"
    },
    {
      "term": "story.twists",
      "source": "llm_inferred",
      "confidence": "medium"
    },
    {
      "term": "pacing.fast",
      "source": "llm_inferred",
      "confidence": "medium"
    },
    {
      "term": "tone.serious",
      "source": "llm_inferred",
      "confidence": "high"
    }
  ]
}
