{
  "schema_version": 1,
  "operation": "set_semantic_fingerprint",
  "operation_id": "c4923889-ca54-4b15-ac2d-efd2a2914a53",
  "work_ref": {
    "id": "ready-player-one-2018"
  },
  "traits": [
    {"term": "pacing.fast", "source": "llm_inferred", "confidence": "high"},
    {"term": "atmosphere.immersive", "source": "llm_inferred", "confidence": "high"},
    {"term": "visuals.strong", "source": "llm_inferred", "confidence": "high"},
    {"term": "action.strong", "source": "llm_inferred", "confidence": "high"},
    {"term": "worldbuilding.strong", "source": "llm_inferred", "confidence": "high"},
    {"term": "story.problem_solving", "source": "llm_inferred", "confidence": "medium"},
    {"term": "structure.ensemble", "source": "llm_inferred", "confidence": "medium"},
    {"term": "tone.light", "source": "llm_inferred", "confidence": "medium"}
  ]
}