{
  "schema_version": 1,
  "operation": "set_semantic_fingerprint",
  "operation_id": "e69981fe-2299-4740-986e-1e3d78f914ed",
  "work_ref": {
    "id": "grand-budapest-hotel-2014"
  },
  "traits": [
    {"term": "visuals.strong", "source": "llm_inferred", "confidence": "high"},
    {"term": "atmosphere.immersive", "source": "llm_inferred", "confidence": "high"},
    {"term": "humor.witty", "source": "llm_inferred", "confidence": "high"},
    {"term": "structure.ensemble", "source": "llm_inferred", "confidence": "high"},
    {"term": "characters.charisma", "source": "llm_inferred", "confidence": "high"},
    {"term": "humor.absurd", "source": "llm_inferred", "confidence": "medium"},
    {"term": "pacing.fast", "source": "llm_inferred", "confidence": "medium"},
    {"term": "tone.light", "source": "llm_inferred", "confidence": "medium"}
  ]
}
