{
  "schema_version": 1,
  "operation": "set_semantic_fingerprint",
  "operation_id": "4b3bdf46-b96a-4b3f-a5ee-615fe4a026d1",
  "work_ref": {
    "id": "twelve-monkeys-1995"
  },
  "traits": [
    {"term": "tone.dark", "source": "llm_inferred", "confidence": "high"},
    {"term": "structure.mystery", "source": "llm_inferred", "confidence": "high"},
    {"term": "story.intrigue", "source": "llm_inferred", "confidence": "high"},
    {"term": "story.twists", "source": "llm_inferred", "confidence": "high"},
    {"term": "atmosphere.immersive", "source": "llm_inferred", "confidence": "high"},
    {"term": "worldbuilding.strong", "source": "llm_inferred", "confidence": "medium"},
    {"term": "pacing.slow", "source": "llm_inferred", "confidence": "medium"},
    {"term": "characters.depth", "source": "llm_inferred", "confidence": "medium"}
  ]
}
