{
  "schema_version": 1,
  "operation": "set_semantic_fingerprint",
  "operation_id": "1b0f9de2-8c1e-42c6-8f7e-fe11b413a439",
  "work_ref": {
    "id": "batman-2022"
  },
  "traits": [
    {"term": "tone.dark", "source": "llm_inferred", "confidence": "high"},
    {"term": "atmosphere.immersive", "source": "llm_inferred", "confidence": "high"},
    {"term": "visuals.strong", "source": "llm_inferred", "confidence": "high"},
    {"term": "structure.mystery", "source": "llm_inferred", "confidence": "high"},
    {"term": "pacing.slow", "source": "llm_inferred", "confidence": "medium"},
    {"term": "story.intrigue", "source": "llm_inferred", "confidence": "medium"},
    {"term": "characters.depth", "source": "llm_inferred", "confidence": "medium"},
    {"term": "action.strong", "source": "llm_inferred", "confidence": "medium"}
  ]
}
