{
  "schema_version": 1,
  "operation": "set_semantic_fingerprint",
  "operation_id": "0f703a07-b046-41f6-a13e-57b2cef208bf",
  "work_ref": {
    "id": "knives-out-2019"
  },
  "traits": [
    {"term": "structure.mystery", "source": "llm_inferred", "confidence": "high"},
    {"term": "story.intrigue", "source": "llm_inferred", "confidence": "high"},
    {"term": "story.twists", "source": "llm_inferred", "confidence": "high"},
    {"term": "humor.witty", "source": "llm_inferred", "confidence": "high"},
    {"term": "structure.ensemble", "source": "llm_inferred", "confidence": "high"},
    {"term": "dialogue.strong", "source": "llm_inferred", "confidence": "medium"},
    {"term": "story.logic", "source": "llm_inferred", "confidence": "medium"},
    {"term": "pacing.moderate", "source": "llm_inferred", "confidence": "medium"}
  ]
}
